{
  "doc_id": "sample",
  "source_file": "data/raw/HR/sample_raw.txt",
  "department": "HR",
  "elements": [
    {
      "type": "Title",
      "text": "人力資源部請假規則",
      "metadata": {}
    },
    {
      "type": "NarrativeText",
      "text": "一、特休。員工每滿六個月可享三日特休，滿一年起依勞基法計算。",
      "metadata": {}
    },
    {
      "type": "NarrativeText",
      "text": "二、事假。因私事需處理者，每次至少半日，全年累計不得超過十四日。",
      "metadata": {}
    },
    {
      "type": "NarrativeText",
      "text": "三、病假。檢附醫療證明，全年不得超過三十日。超過部分依公司規定辦理。",
      "metadata": {}
    }
  ]
}
